{
  "attribution": {
    "definition_source": "Open English WordNet 2025",
    "editorial_statement": "Bangla explanation and examples adapted and written for Ovidhan.",
    "license": "CC BY 4.0",
    "license_url": "https://creativecommons.org/licenses/by/4.0/",
    "source_url": "https://en-word.net/"
  },
  "headword": "thrive",
  "provenance": {
    "oewn": {
      "archive_sha256": "38b16326159f51853626b7d24a44c453fa88ab33f06fce5ec8fc5996d1c2be93",
      "provenance_file": "dictionary-v2/oewn-2025-provenance.json",
      "release": "2025"
    },
    "v1_migration": {
      "source_page": "word/thrive.html",
      "source_page_sha256_lf": "b790240e5ddaa3cf101c2ac7e6530f35806c4f7e8a8d2300b57f89bca35f18f5",
      "tool": "scripts/dictionary-v2/migrate-v1.js@1.0.0"
    }
  },
  "record_status": "V1_MIGRATION",
  "schema_version": "1.0.0",
  "senses": [
    {
      "bangla_explanation": {
        "origin": "OVIDHAN_EDITORIAL",
        "text": "thrive মানে সুস্থ, সফল ও সমৃদ্ধভাবে বেড়ে ওঠা।"
      },
      "bangla_meaning": {
        "display": "ভালোভাবে বেড়ে ওঠা",
        "origin": "OVIDHAN_EDITORIAL"
      },
      "definition": {
        "oewn_definition": "grow vigorously",
        "origin": "OEWN_GLOSS",
        "text": "grow vigorously"
      },
      "examples": [
        {
          "bn": "গরম ও ভেজা আবহাওয়ায় গাছপালা ভালোভাবে বেড়ে ওঠে।",
          "en": "Plants thrive in warm and wet weather.",
          "origin": "OVIDHAN_EDITORIAL"
        }
      ],
      "pos": "verb",
      "sense_id": "s1",
      "source": {
        "synset_id": "00322795-v",
        "type": "OEWN_2025"
      },
      "v1_primary": true
    }
  ],
  "slug": "thrive"
}
