{
  "attribution": {
    "definition_source": "Open English WordNet 2025",
    "editorial_statement": "Bangla explanation and examples adapted and written for Ovidhan.",
    "license": "CC BY 4.0",
    "license_url": "https://creativecommons.org/licenses/by/4.0/",
    "source_url": "https://en-word.net/"
  },
  "headword": "swarm",
  "provenance": {
    "oewn": {
      "archive_sha256": "38b16326159f51853626b7d24a44c453fa88ab33f06fce5ec8fc5996d1c2be93",
      "provenance_file": "dictionary-v2/oewn-2025-provenance.json",
      "release": "2025"
    },
    "v1_migration": {
      "source_page": "word/swarm.html",
      "source_page_sha256_lf": "f18c3a918d6f66e01c72ff63dea2cb25ac79938eccc55aaae5b6e9f3190efaab",
      "tool": "scripts/dictionary-v2/migrate-v1.js@1.0.0"
    }
  },
  "record_status": "V1_MIGRATION",
  "schema_version": "1.0.0",
  "senses": [
    {
      "bangla_explanation": {
        "origin": "OVIDHAN_EDITORIAL",
        "text": "বাতাসে বা মাটিতে একসঙ্গে ঘুরে বেড়ানো অনেক প্রাণী বা জিনিসের দলকে swarm বলে।"
      },
      "bangla_meaning": {
        "display": "ঝাঁক",
        "origin": "OVIDHAN_EDITORIAL"
      },
      "definition": {
        "contamination": [
          {
            "kind": "OEWN_QUOTED_EXAMPLES_IN_DEFINITION",
            "quoted_examples": [
              "a swarm of insects obscured the light",
              "clouds of blossoms",
              "it discharged a cloud of spores"
            ]
          }
        ],
        "oewn_definition": "a group of many things in the air or on the ground",
        "origin": "OEWN_GLOSS",
        "text": "a group of many things in the air or on the ground; \"a swarm of insects obscured the light\"; \"clouds of blossoms\"; \"it discharged a cloud of spores\""
      },
      "examples": [
        {
          "bn": "পুরোনো গাছ থেকে মৌমাছির এক ঝাঁক বেরিয়ে গেল।",
          "en": "A swarm of bees left the old tree.",
          "origin": "OVIDHAN_EDITORIAL"
        }
      ],
      "pos": "noun",
      "sense_id": "s1",
      "source": {
        "synset_id": "07382354-n",
        "type": "OEWN_2025"
      },
      "v1_primary": true
    }
  ],
  "slug": "swarm"
}
