{
  "attribution": {
    "definition_source": "Open English WordNet 2025",
    "editorial_statement": "Bangla explanation and examples adapted and written for Ovidhan.",
    "license": "CC BY 4.0",
    "license_url": "https://creativecommons.org/licenses/by/4.0/",
    "source_url": "https://en-word.net/"
  },
  "headword": "lunch",
  "provenance": {
    "oewn": {
      "archive_sha256": "38b16326159f51853626b7d24a44c453fa88ab33f06fce5ec8fc5996d1c2be93",
      "provenance_file": "dictionary-v2/oewn-2025-provenance.json",
      "release": "2025"
    },
    "v1_migration": {
      "source_page": "word/lunch.html",
      "source_page_sha256_lf": "efab4b62243c48ed0c67eafdaad0c6ca25fb61ddc2c59e9fec12d20eb4f7ec13",
      "tool": "scripts/dictionary-v2/migrate-v1.js@1.0.0"
    }
  },
  "record_status": "V1_MIGRATION",
  "schema_version": "1.0.0",
  "senses": [
    {
      "bangla_explanation": {
        "origin": "OVIDHAN_EDITORIAL",
        "text": "দিনের মাঝামাঝি সময়ে যে আহার খাওয়া হয়, তাকে lunch বলে।"
      },
      "bangla_meaning": {
        "display": "দুপুরের খাবার",
        "origin": "OVIDHAN_EDITORIAL"
      },
      "definition": {
        "oewn_definition": "a midday meal",
        "origin": "OEWN_GLOSS",
        "text": "a midday meal"
      },
      "examples": [
        {
          "bn": "আমরা দুপুরের খাবারের জন্য ভাত ও ডিম নিয়ে গিয়েছিলাম।",
          "en": "We packed rice and eggs for lunch.",
          "origin": "OVIDHAN_EDITORIAL"
        }
      ],
      "pos": "noun",
      "sense_id": "s1",
      "source": {
        "synset_id": "06964470-n",
        "type": "OEWN_2025"
      },
      "v1_primary": true
    }
  ],
  "slug": "lunch"
}
