{
  "attribution": {
    "definition_source": "Open English WordNet 2025",
    "editorial_statement": "Bangla explanation and examples adapted and written for Ovidhan.",
    "license": "CC BY 4.0",
    "license_url": "https://creativecommons.org/licenses/by/4.0/",
    "source_url": "https://en-word.net/"
  },
  "headword": "chaos",
  "provenance": {
    "oewn": {
      "archive_sha256": "38b16326159f51853626b7d24a44c453fa88ab33f06fce5ec8fc5996d1c2be93",
      "provenance_file": "dictionary-v2/oewn-2025-provenance.json",
      "release": "2025"
    },
    "v1_migration": {
      "source_page": "word/chaos.html",
      "source_page_sha256_lf": "4a9de51179c317d239c6a0dd8d28189d98704f83e2887888e0f3b1cb696940f1",
      "tool": "scripts/dictionary-v2/migrate-v1.js@1.0.0"
    }
  },
  "record_status": "V1_MIGRATION",
  "schema_version": "1.0.0",
  "senses": [
    {
      "bangla_explanation": {
        "origin": "OVIDHAN_EDITORIAL",
        "text": "গোলমাল যখন চরমে, সেই অবস্থার নাম chaos।"
      },
      "bangla_meaning": {
        "display": "চরম বিশৃঙ্খলা",
        "origin": "OVIDHAN_EDITORIAL"
      },
      "definition": {
        "oewn_definition": "a state of extreme confusion and disorder",
        "origin": "OEWN_GLOSS",
        "text": "a state of extreme confusion and disorder"
      },
      "examples": [
        {
          "bn": "সব খেয়া একসঙ্গে বাতিল হলে যাত্রীছাউনিতে চরম বিশৃঙ্খলা নেমে এল।",
          "en": "Chaos filled the terminal when every launch was cancelled at once.",
          "origin": "OVIDHAN_EDITORIAL"
        }
      ],
      "pos": "noun",
      "sense_id": "s1",
      "source": {
        "synset_id": "11275622-n",
        "type": "OEWN_2025"
      },
      "v1_primary": true
    }
  ],
  "slug": "chaos"
}
