{
  "attribution": {
    "definition_source": "Open English WordNet 2025",
    "editorial_statement": "Bangla explanation and examples adapted and written for Ovidhan.",
    "license": "CC BY 4.0",
    "license_url": "https://creativecommons.org/licenses/by/4.0/",
    "source_url": "https://en-word.net/"
  },
  "headword": "toxic",
  "provenance": {
    "oewn": {
      "archive_sha256": "38b16326159f51853626b7d24a44c453fa88ab33f06fce5ec8fc5996d1c2be93",
      "provenance_file": "dictionary-v2/oewn-2025-provenance.json",
      "release": "2025"
    },
    "v1_migration": {
      "source_page": "word/toxic.html",
      "source_page_sha256_lf": "8e1626810f6356f98c1714b633024486c0dda11a18c80147d270fcf6b3a681cf",
      "tool": "scripts/dictionary-v2/migrate-v1.js@1.0.0"
    }
  },
  "record_status": "V1_MIGRATION",
  "schema_version": "1.0.0",
  "senses": [
    {
      "bangla_explanation": {
        "origin": "OVIDHAN_EDITORIAL",
        "text": "বিষ থেকে সৃষ্ট বা বিষের সঙ্গে জড়িত অবস্থার নাম toxic।"
      },
      "bangla_meaning": {
        "display": "বিষাক্ত",
        "origin": "OVIDHAN_EDITORIAL"
      },
      "definition": {
        "oewn_definition": "of or relating to or caused by a toxin or poison",
        "origin": "OEWN_GLOSS",
        "text": "of or relating to or caused by a toxin or poison"
      },
      "examples": [
        {
          "bn": "রংয়ের আধার উপচে পড়ার পর কারখানার বর্জ্য খালটিকে বিষাক্ত করে তোলে।",
          "en": "Factory waste turned the canal toxic after the dye tanks overflowed.",
          "origin": "OVIDHAN_EDITORIAL"
        }
      ],
      "pos": "adjective",
      "sense_id": "s1",
      "source": {
        "synset_id": "02467955-a",
        "type": "OEWN_2025"
      },
      "v1_primary": true
    }
  ],
  "slug": "toxic"
}
