{
  "attribution": {
    "definition_source": "Open English WordNet 2025",
    "editorial_statement": "Bangla explanation and examples adapted and written for Ovidhan.",
    "license": "CC BY 4.0",
    "license_url": "https://creativecommons.org/licenses/by/4.0/",
    "source_url": "https://en-word.net/"
  },
  "headword": "baddie",
  "provenance": {
    "oewn": {
      "archive_sha256": "38b16326159f51853626b7d24a44c453fa88ab33f06fce5ec8fc5996d1c2be93",
      "provenance_file": "dictionary-v2/oewn-2025-provenance.json",
      "release": "2025"
    },
    "v1_migration": {
      "source_page": "word/baddie.html",
      "source_page_sha256_lf": "3d381e1f339ea9b1b03e22533e3279333323d1ccd06e0fdd1aa40ac3db55b652",
      "tool": "scripts/dictionary-v2/migrate-v1.js@1.0.0"
    }
  },
  "record_status": "V1_MIGRATION",
  "schema_version": "1.0.0",
  "senses": [
    {
      "bangla_explanation": {
        "origin": "OVIDHAN_EDITORIAL",
        "text": "চলচ্চিত্র বা কল্পকাহিনির প্রধান মন্দ চরিত্রকে বলে baddie।"
      },
      "bangla_meaning": {
        "display": "কাহিনির প্রধান খলনায়ক",
        "origin": "OVIDHAN_EDITORIAL"
      },
      "definition": {
        "oewn_definition": "the principal bad character in a film or work of fiction",
        "origin": "OEWN_GLOSS",
        "text": "the principal bad character in a film or work of fiction"
      },
      "examples": [
        {
          "bn": "পুতুলনাচে খলনায়ক বেরোতেই শিশুরা হুংকার দিয়ে উঠল।",
          "en": "Children booed as soon as the baddie appeared in the puppet show.",
          "origin": "OVIDHAN_EDITORIAL"
        }
      ],
      "pos": "noun",
      "sense_id": "s1",
      "source": {
        "synset_id": "09247363-n",
        "type": "OEWN_2025"
      },
      "v1_primary": true
    }
  ],
  "slug": "baddie"
}
